0,大瓜头和白小雪的100分！,100 points for Daguatou and Bai Xiaoxue!
1,盘点12生肖对应的奥特曼，我对应的是捷德，你们对应的是谁？,"Inventory of the Ultraman corresponding to the 12 zodiac signs, I correspond to Ged, who do you correspond to?"
2,假如让你选奥特曼当你同桌，赛罗VS格丽乔，你会选择谁？,"If you were to choose Ultraman as your tablemate, Ciro VS Gregory, who would you choose?"
3,假如这四位奥特曼当你的老师，你们会喜欢吗？,"If these four Ultraman were your teachers, would you like it?"
4,白小雪会给黑暗魔王小红心吗？,Will Bai Xiaoxue give the Dark Demon King a little red heart?
5,小雪的七彩魔法太阳！,Koyuki's colorful magic sun!
6,白小雪和白小贝选盲盒！,Bai Xiaoxue and Bai Xiaobei choose a blind box!
7,白小雪和白小贝坐小火车！,Bai Xiaoxue and Bai Xiaobei take the little train!
8,小雪怎么收集了这么多黑心？,How did Xiaoxue collect so many black hearts?
9,白小雪的妈妈变成了宝宝！,Bai Xiaoxue's mother has become a baby!
10,小雪是最厉害的食物宝宝吗？,Is Xiaoxue the most powerful food baby?
11,白小雪抠糖饼大挑战！,Bai Xiaoxue's Sugar Cake Challenge!
12,小雪的宠物盲居然开出了凤凰！,Xiaoxue's pet blind actually opened a phoenix!
13,小雪怎么一直在吃汉堡？,Why does Xiaoxue keep eating hamburgers?
14,小雪和小贝玩植物大战僵尸！,Xiaoxue and Xiaobei play Plants vs. Zombies!
15,小雪的彩虹娃娃被抢走了！,Koyuki's rainbow doll has been stolen!
16,小雪考了100分为什么没人喜欢？,"Xiaoxue scored 100 points in the test, why no one likes it?"
17,小雪和小贝的父母为什么要分开？,Why did Xiaoxue and Xiaobei's parents separate?
18,白小雪的红心卡片不见了！,Bai Xiaoxue's red heart card is gone!
19,小雪怎么给爸爸打0分？,How does Xiaoxue give Dad 0 points?
20,白雪公主帮助彩虹恢复颜色,Snow White helps the rainbow restore color
21,白雪公主贝儿公主大头儿子的彩虹牙齿,Rainbow Teeth of Snow White Belle's Big-Headed Son
22,大瓜头的蜡笔会回来吗？,Will Daguatou's crayons come back?
23,小雪和艾莎谁是最美天使？,"Who is the most beautiful angel, Xiaoxue and Elsa?"
24,小雪和小贝拯救彩虹！,Xiaoxue and Xiaobei save the rainbow!
25,小雪和小贝的超能力！,The super powers of Xiaoxue and Xiaobei!
26,白小雪能打败太阳吗？,Can Bai Xiaoxue beat the sun?
27,老师给小雪和小贝的卡片！,The teacher's card for Xiaoxue and Xiaobei!
28,小雪怎么有三个妈妈？,Why does Xiaoxue have three mothers?
29,咖子谜题：奥特曼当了牙医，他给青蛙拔了几颗牙？,"Kazi puzzle: Ultraman became a dentist, how many teeth did he pull out of the frog?"
30,是小雪弄坏了小贝的手机吗？,Did Xiaoxue break Xiaobei's phone?
31,关于童年的《迪迦·奥特曼》你还知道多少？快来测测你的熟悉程度吧！,"How much do you know about the childhood ""Ultraman Tiga""? Come and test your familiarity!"
32,小雪能进入红心王国吗？,Can Xiaoxue enter the Kingdom of Hearts?
33,【UNDERTALE动画】60帧!!! 酷炸的原衫战完整版!!!(改设),[UNDERTALE animation]60 frames!!! The full version of the cool original shirt battle!!! (Redesign)
34,Mini Crewmate 杀死几何冲刺Boss | Among Us,Mini Crewmate Kill Geometry Dash Boss | Among Us
35,【茶杯头动画】一不小心兄弟就炸了,"[Cup Head Animation] Accidentally, my brother exploded"
36,小雪和小贝谁是精灵女王的宝宝？,"Xiaoxue and Xiaobei, who is the baby of the fairy queen?"
37,小雪和小贝怎么都牙疼了？,Why did Xiaoxue and Xiaobei have a toothache?
38,白雪公主贝儿公主怎么变成小宝宝了？,How did Snow White and Belle become a baby?
39,谁才是真正的白小雪？,Who is the real Bai Xiaoxue?
40,白雪公主贝儿公主又玩眼睛猜猜乐,Snow White and Belle play Guess the Eyes again
41,盘点奥特曼中的5对恋人，你最喜欢那一对呢？迪迦被骂是渣男！,"Inventory of the 5 pairs of lovers in Ultraman, which one is your favorite? Tiga was scolded as a scumbag!"
42,汤姆：法庭上禁止0元购！！！,Tom: The court prohibits 0 yuan purchases! ! !
43,不同国家的新版哆啦A梦，精选6国7语版《实现梦想的哆啦A梦》,"New versions of Doraemon from different countries, a selection of 6 countries and 7 languages ​​""Doraemon Realizing Dreams"""
44,人偶学园 第3课 如果我姐姐是魔法少女该怎么办？,Doll Academy Lesson 3 What if my sister is a magical girl?
45,8岁那年深夜，村民包围了我爹的去世现场！,"In the middle of the night when I was 8 years old, the villagers surrounded the scene of my father's death!"
46,“你们的童年DNA这回可能全乱了！”【高全胜】,"""Your childhood DNA may be all messed up this time!"" [Gao Quansheng]"
47,最经典的西游动画居然有两个版本！99版《西游记》为什么如此深入人心？,"There are actually two versions of the most classic Journey to the West animation! Why is the 99 edition of ""Journey to the West"" so popular?"
48,"【蓝光1080P60帧】Brave Love,TIGA【高燃MAD】","[Blu-ray 1080P60 Frames] Brave Love, TIGA [High Burning MAD]"
49,【Undertale动画/授权转载】sans vs chara,[Undertale animation/authorized reprint] sans vs chara
50,【Undertale/Among Us动画/中文字幕】Sans VS Frisk,[Undertale/Among Us animation/Chinese subtitles]Sans VS Frisk
51,年度动画番剧概念PV_Undertale：echo2022〖传说之下新春会单品〗,Annual animation fan drama concept PV_Undertale: echo2022 [Chinese New Year party items under the legend]
52,【Sans × Frisk】当各个au的sans遇到人类调情,[Sans × Frisk]When sans of various au meet human flirting
53,【UNDERTALE短動畫】各個Frisk的ぷえぷえ(多AU，含SF),"[UNDERTALE short animation]Frisk's ぷえぷえ (multiple AU, including SF)"
54,【动画】亿 之 猫 审 判 战,[Animation]Billion Cat Trial Battle
55,【都市/情感】《唐可可的诱惑》第二集,"[Urban/Emotion] ""The Temptation of Tang Keke"" Episode 2"
56,【都市/情感】《唐可可的诱惑》第八集,"[Urban/Emotion] Episode 8 of ""The Temptation of Tang Keke"""
57,【都市/情感】《唐可可的诱惑》第四集,"[Urban/Emotion] Episode 4 of ""The Temptation of Tang Keke"""
58,如果DIO是女孩子（日语配音）,If DIO was a girl (Japanese dub)
59,【都市/情感】《唐可可的诱惑》第三集,"[Urban/Emotion] ""The Temptation of Tang Keke"" Episode 3"
60,【朱亚文】12反派渣渣线下碰头会，来人一锅端了啊#甭正面#10,"[Zhu Yawen] 12 villain slag slag meet offline, come to a pot"
61,【原神】五等分のカタチ,[Genshin Impact] The shape of five equal parts
62,茶啊二中番外篇 男寝501 06 新说葫芦娃,Tea Ah No. 2 Middle School Extra Story Men's Bedroom 501 06 New Talking Gourd Baby
63,小夫...你终究是被生活磨尖了棱角..,Xiaofu...you are sharpened by life after all..
64,伊之助香奈乎对阵上弦之二【鬼灭之刃动画】,Kana Inosuke vs. Winding No. 2 [Animation of the Blade of Demon Slayer]
65,震惊！为了蝴蝶忍庆生 大家居然做出这种事情,"Shock! To celebrate the birthday of Butterfly Ninja, everyone actually did this kind of thing"
66,【义忍情人节特别篇】蝴蝶忍扑倒义勇？！恋爱尚未成功 义勇仍需努力！鬼灭之刃自制狗粮向同人,"[Yi Ren Valentine's Day Special]Butterfly Ninja beat Yi Yong? ! Love has not yet succeeded, volunteering still needs to work hard! Ghost Slayer's self-made dog food"
67,看完1月新番，乐得我当场打开了剪辑软件！【泛式】,"After watching the new show in January, I was so happy that I opened the editing software on the spot! [Generic]"
68,哥哥，你女朋友不会揍你吧?,"Brother, your girlfriend won't beat you, will she?"
69,斯大林模式已开启,Stalin mode is on
70,当奥特曼听说B站上架了奥特曼后,When Ultraman heard that Ultraman was on the shelves at station B
71,测测你对利威尔兵长的熟悉程度吧！,Test your familiarity with Captain Levi!
72,没让你模仿更没让你超越！听说比正版还好的130元盗版狂三手办？,Didn't let you imitate and didn't let you surpass! I heard that the 130 yuan pirated version is better than the original one?
73,泰拉高质量骷髅王视频流出,Terra high-quality Skeleton King video flow out
74,实在是过于强大的奥尔加团长（最终篇）,"Captain Olga, who is too powerful (final chapter)"
75,【花花×子君】暗号,[Flower × Zijun]Code
76,关于《进击的巨人》抄袭《喜羊羊与灰太狼》这件事 你以为我会告诉你吗？,"Do you think I'll tell you about ""Attack on Titan"" plagiarizing ""Pleasant Goat and Big Big Wolf""?"
77,乔鲁诺单人速通黄金之风,Giorno Solo Speedrun Golden Wind
78,进 击 の 可 莉,Attack の Keli
79,【彩虹社】被小情侣当作下酒菜的安洁【安洁·卡特莉娜】,"[Rainbow Club] Anjie, who was used as a snack by young lovers [Angie Katrina]"
80,【唐诱二创】《无法原谅》8bit版,"[Tang Yu Erchuang] ""Unforgivable"" 8bit version"
81,【都市/情感】《唐可可的诱惑》第六集,"[Urban/Emotion] Episode 6 of ""The Temptation of Tang Keke"""
82,筆,Pen
83,【宝石之国】判若两人的主角！动画完结后那刀人不偿命的绝望故事（第1期）,[Land of Jewels]The protagonist who looks like two people! The story of desperation after the animation ended (the first issue)
84,这货一定是吃可爱长大的！三倍快乐！银河也是河嘛！,This stuff must be cute and grown up! Happy three times! The Milky Way is also a river!
85,【刀剑乱舞】上弦月【手书】,[Sword Ranbu]Crescent Moon [Handwriting]
86,快逃！纸板成精了！！,Run away! Cardboard is fine! !
87,【伊芙利特】HIP【明日方舟meme】,[Ifrit]HIP[Tomorrow's Ark meme]
88,爆肝528小时！我做出了《海绵宝宝》3D同人动画！（3）,Explosive liver 528 hours! I made a 3D animation of SpongeBob SquarePants! (3)
89,火柴人 -  魔法 VS 机械,Stickman - Magic VS Mechanical
90,【原神MMD】你跳舞，我给杏仁豆腐,"[Yuanshen MMD]You dance, I give almond tofu"
91,【Undertale】一拳超人 in undertale,[Undertale]One Punch Man in undertale
92,【海贼王】每天都看到船长大人在作死【罗路微糖】【路飞中心 全员宠溺向】,[One Piece] Every day I see the captain dying [Luo Lu Wei Tang] [All members of Luffy Center love it]
93,up主，你的脸疼吗？2020年1月新番打脸大总结！,"Lord, does your face hurt? Summary of the new face slaps in January 2020!"
94,史上最崩的霸权番，一个镜头能崩出七个画风..,"The most collapsed hegemony fan in history, one shot can collapse seven styles.."
95,【彩虹社】动画MAD,[Rainbow Club]Animation MAD
96,【狐狸精】一拳一个狐狸精，埼玉龙卷索尼克,"[Fox Spirit] One Punch, One Fox Spirit, Saitama Tornado Sonic"
97,大 雄 的 奇 妙 冒 险,Nobita's Bizarre Adventure
98,那些死亡时最让人伤心的角色TOP44【美网评选】,TOP44 Most Sad Characters When They Die [U.S. Open Selection]
99,2021日本动漫热度排名,2021 Japanese Anime Popularity Ranking
100,刻在DNA里的那些动漫台词跟场面，你知道多少？,How much do you know about those anime lines and scenes engraved in DNA?
101,【烧脑短片】降维攻击为什么可怕，看这动画就明白了,[Brain-burning short film] Why is the dimensionality reduction attack terrible? Watch this animation to understand
102,【the wellerman】五常压迫感2.0（中文五常填词）,[the wellerman] Wuchang Sense of Oppression 2.0 (Chinese Wuchang lyrics)
103,国 产 动 画 顶 级 打 戏！《一人之下3》,"The top domestic animation drama! ""Under One Person 3"""
104,什么叫做游刃有余啊【女仆装温迪·测试·原神MMD】,What does it mean to be at ease [Maid costume Wendy·Test·Genshin MMD]
105,火影忍者超燃打戏——乖乖束手就擒吧！,Naruto's super-burning fight - be obedient and capture it!
106,【魔法少女小圆】在失去爱人的世界里，到底会开出什么颜色的花朵呢？-永远的迷宫物语-魔圆黑色篇,"[Magic Girl Madoka] In a world that has lost her lover, what color flowers will bloom? - Eternal Labyrinth Story - Magic Circle Black Arc"
107,【明日方舟自制PPT】最后的 进军,[Tomorrow's Ark Homemade PPT] The Last March
108,我不是恶魔，人类才是,"I'm not a demon, humans are"
109,【魔圆AMV/视觉盛宴/高燃踩点】粉碎这无止境的绝望！！,[Magic Circle AMV/Visual Feast/High Burning Steps] Smash this endless despair! !
110,太妙了！这才是一人之下第三季！【顶级打戏/高燃踩点】,Wonderful! This is the third season under one person! [Top fighting drama / high-burning stepping point]
111,最终话回炉再造？打戏炸裂！历史考据细致入微，国产动画绝对良心之作,"The final words are reworked? The play blows up! The historical research is meticulous, and the domestic animation is definitely a work of conscience"
112,柯南没有播出过的一集！人在微波炉里被烤死！《名侦探柯南特别篇》！,"An episode of Conan that never aired! People get roasted to death in the microwave! ""Detective Conan Special""!"
113,病娇男孩 在线发疯,sick boy crazy online
114,在我的BGM里是无敌的！一起吐槽妖精的尾巴剧场版龙之泪,Invincible in my BGM! Tucao fairy tail theatrical version of dragon tears
115,柯南最新一集！！！太搞笑了完全把持不住啊哈哈哈哈哈哈！！！！！！【走进柯学】,Conan's latest episode! ! ! It's so funny I can't hold it anymore hahahahahaha! ! ! ! ! ! [Into Ke Xue]
116,【神奇宝贝人物志】，为什么小智的藤藤蛇这么受欢迎呢？,"[Pokémon Characters], why is Ash's rattan snake so popular?"
117,德纲学姐说相声,Degang-senpai speaks cross talk
118,柯南这集把我胃笑穿了哈哈哈哈哈哈！！！！【走进柯学】,This episode of Conan made me laugh through my stomach hahahahahahahahahahahahahahahahahahahaha ! ! ! [Into Ke Xue]
119,“谨以此片，献给那位宛若神明的女孩！”,"""I would like to dedicate this film to that girl who is like a god!"""
120,当你请到了穹妹本人来跟你连麦会怎么样！全程高能,What will happen when you invite Qiongmei herself to come with you! High energy throughout
121,我一大早接到了蕾姆的诈骗电话....,I got a scam call from Rem early in the morning...
122,两只老虎爱煎蛋,Two tigers love fried eggs
123,【开端手书】易燃易爆炸,[Beginning handwritten] Flammable and explosive
124,用三十部动漫唱一首《童话镇》，一切都是成长，包括热泪盈眶！,"Sing a song ""Fairy Tale Town"" with thirty animes, everything is growth, including tears!"
125,笑到当场成仙！从1000多部动画中精选出的18部神级搞笑动画！【第4期】,Laugh until you become a fairy on the spot! 18 god-level funny animations selected from more than 1000 animations! [Issue 4]
126,"带大家光临一家""有去无回""的按摩店！【捏碳小剧场】搞笑","Take everyone to a massage parlor with ""going and going""! [Pinch Carbon Theater]Funny"
127,这TM才叫公主连结！,This TM is called Princess Link!
128,"上车吗？开去""天国""的那种 【捏碳小剧场】原创动画|搞笑","Get in the car? The kind that goes to ""Heaven"" [Pinch Carbon Theater] Original Animation | Funny"
129,吉良吉影大小姐想让我告白~枯萎穿心！,Miss Yoshikage Kira wants me to confess~ Wither through my heart!
130,惨无人道！盾娘最恐怖最凶残最恶质的技能——百鬼夜行！【盾娘科普剧透注意】,"inhuman! Shield Maiden's most terrifying, ferocious and vicious skill - Hundred Ghosts Night Walk! [SPOILER NOTE FOR Shield Niang's Popular Science]"
131,【扒】《瑞克和莫蒂》S4大结局：宇宙巅峰战力如何打架？这集每个人都有极致的发挥！,"[Pop up] ""Rick and Morty"" S4 finale: how to fight at the peak of the universe? Everyone did their best in this episode!"
132,小伙被迫继承百亿家产还送一老婆？假面骑士01开篇吐槽【诚实吐槽】,The guy was forced to inherit tens of billions of property and give away a wife? Kamen Rider 01 Opening Tucao [Honest Tucao]
133,（萌新向）为何学园都市最强lv5七人都被称为“残疾人”?,"(Meng Xinxiang) Why are the seven strongest lv5 people in Academy City called ""disabled""?"
134,评分4.0！拷打2021年度最烂动画《进化之实》！难以言喻的反向神作！,"Rated 4.0! Torture the worst animation ""Evolutionary Reality"" in 2021! An indescribable reverse masterpiece!"
135,泳 池 放 屁，人 间 杀 器！！,"Swimming pool farts, world killer! !"
136,【用肝画1372张】只为让二乔变年轻！！（是动画，是视频，不是静态图片）满脸无敌画的真累。,"[1372 pictures with liver] Just to make Er Qiao younger! ! (It's an animation, it's a video, not a still picture) It's really tiring to draw with invincible faces."
137,平 行 世 界 吉 良 吉 影,Hirayuki Sekai Yoshikage Kira
138,谁是洗脑之王？平成嘿嘿剑VS令和嘿嘿枪！假面骑士音效歌（第三十期）,Who is the king of brainwashing? Heisei Hehe Sword VS Reiwa Hehe Gun! Kamen Rider sound effect song (thirtieth issue)
139,假  面  骑  士  特  利  迦,Kamen Rider Trika
140,（特效字幕版）一首音效歌听完假面骑士01TV！假面骑士音效歌（第十七期）,"(Special effect subtitle version) After listening to a sound effect song, Kamen Rider 01TV! Kamen Rider sound effect song (17th issue)"
141,【假面骑士/MAD】全假面骑士最终形态盛宴！以凄厉的黑暗追逐闪耀的繁星！,[Kamen Rider/MAD]Feast of all Kamen Rider final form! Chase the shining stars with piercing darkness!
142,中文版《天气之子》主题曲翻唱【七濑胡桃】,"Chinese version of ""Weathering With You"" Theme Song Cover [Nanase Walnut]"
143,【JOJO】流汗吧 荒木庄少女！,"[JOJO] Sweat, Araki-so girl!"
144,【爷团】 爷 帮 摇,[Grandpa group] Grandpa help shake
145,从前有一只兔子叫做桐生战兔,Once upon a time there was a rabbit called Kiryu War Rabbit
146,高木同学的橙汁一直喷不出来【擅长摇橙汁的高木同学】,Takagi-san's orange juice has never been sprayed out [Takagi-san who is good at shaking orange juice]
147,骨头社最嗨打斗作画动画——《灵能百分百》合集作画MAD,"Bone Club's most exciting fighting animation - ""100% Psionics"" collection painting MAD"
148,“这就是你爱上排球的瞬间”,"""This is the moment you fall in love with volleyball"""
149,“你终于活成了她的样子。”,"""You finally lived like her."""
150,【宿伏|cp料】你可以永远相信mappa搞男酮的能力,[Sufu | CP material] You can always believe in mappa's ability to engage in male ketones
151,如果迪士尼是JOJO画风,If Disney were JOJO style
152,[原神MMD] 全 员 净 土,[Genshin MMD] Pure Land for all members
153,【原神MMD】荧：猜猜看，是谁送给我的婚纱 ~ 大喜,[Yuanshen MMD] Ying: Guess who gave me the wedding dress ~ Overjoyed
154,自由和霸权！！！——《进击的巨人》前三季系列作画MAD,"Freedom and hegemony! ! ! ——The first three seasons of ""Attack on Titan"" series painting MAD"
155,【warma】怎么办！我现在好怕被2233娘封号,[warma]What to do! I'm so afraid of being titled by 2233 mother
156,【捏碳小剧场】客人，我要开始捏了噢...！！,"[Pinch Carbon Theater] Guest, I'm going to start pinching...! !"
157,【warma】300万关注啦！来纪念一下吧【沃玛的生活/第七期】,[warma]3 million followers! Let's commemorate it [Woma's life / Issue 7]
158,所向无前：宫子的复仇【公主连结拜年纪单品】,Unstoppable: Miyako's Revenge
159,【官方中文】第14回东方M-1漫才大赛 [中日双语字幕],[Official Chinese] The 14th Oriental M-1 Talent Competition [Chinese and Japanese bilingual subtitles]
160,【熟肉】只用一分钟了解青叶摩卡【邦邦】【まーしー。】,[Cooked Meat]It only takes one minute to learn about Aoba Mocha[Bangbang][まーしー. ]
161,【轻音少女】论妹妹如何把姐姐养成“废萌”的二三事～,"[Light Tone Girl] Two or three things about how my sister made her sister a ""waste cute""~"
162,啊对↗对↗对↗,Ah yes ↗ yes ↗ yes ↗
163,《龙族》《哑舍》正式动画化！你还记得知音漫客·小说绘曾经的2部力作吗？,"""Dragon Race"" and ""Dumb She"" are officially animated! Do you still remember the 2 masterpieces of Zhiyin Manke·Xiaohua?"
164,动漫中无法超越的镜头#1,Unsurpassed shots in anime
165,用四十一部动漫名拼出一首《稻香》·改（他英已删放心食用）,"Spell out a song ""Dao Xiang"" with forty-one anime names. Change (He Ying has been deleted and can be eaten safely)"
166,【实教完结吐槽】浅谈魔改背后的真相！如何评价高人气动画「实力教室」？,"[Complete Tucao] Talking about the truth behind the magic reform! How to evaluate the popular animation ""Strength Classroom""?"
167,福尔摩斯你在干什么！我真的受不了啊啊啊啊啊，能不能不在我面前系鞋带啊！,"What are you doing, Sherlock Holmes! I really can't stand it ah ah ah ah, can you not tie your shoelaces in front of me!"
168,收到10万元SC却发现石油佬打了别的女人的名字,"Received 100,000 yuan SC but found that the oil guy called another woman's name"
169,岁月是把杀猪刀，盘点一下动漫中年轻与年老形象不符的角色们,Time is a pig-killing knife. Let's take a look at the characters who are young and old in anime.
170,反派：抓到你的把柄啦！蜘蛛侠！,Villain: Got your handle! Spiderman!
171,请 务 必 把 腿 抖 断,Please break your legs
172,动画片的脑洞到底能有多大？每个都是大哥级别的存在！,How big is the brain hole of animation? Everyone is a big brother-level existence!
173,当lex、凉风、瓶子和泛式一起联动的四幻同堂对口相声！一定要看到后面，奥利给~,"When lex, cool breeze, bottle and pan-style are linked together, the four fantasy comedy in the same hall! Be sure to see the back, Ollie~"
174,前方高甜！我也就看了几百遍！,High sweetness ahead! I've watched it hundreds of times!
175,【PJSK手书】DAZE【目隐都市的演绎者op】,[PJSK handwritten] DAZE [Deductor op of Megakushi City]
176,《原神》神里手书「若知是梦何须醒，不比真如一相会」,"""Yuanshen"" in the handwriting of the gods ""If you know it's a dream, why should you wake up, it's not as good as meeting the truth"""
177,评分4.9，跌 落 神 坛！疯狂吐槽口碑断崖式下滑的《镇魂街2》，魔改要讲基本法！【国动荟萃】,"Rated 4.9, fell to the altar! Crazy Tucao word-of-mouth decline ""Soul Street 2"", the magic reform must talk about the basic law! [National Movement Gathering]"
178,看完七月新番，吓得我当场打开了剪辑软件！【泛式】,"After watching the new show in July, I was so scared that I opened the editing software on the spot! [Generic]"
179,曾被全网指责抄袭《海贼王》，如今真相大白！《马拉松王子》到底是一部怎样的作品？,"He was once accused by the whole network of plagiarizing ""One Piece"", and now the truth is revealed! What kind of work is ""Prince of Marathon""?"
180,智商不够阿库娅，没用女神莉丝妲。,"The IQ is not enough for Aqua, the goddess Lista is useless."
181,【東雪蓮】超甜翻唱！|  热爱250°C的你 ,[East Snow Lotus] Super sweet cover! |  Love you at 250°C 
182,自制动画，哆啦A梦,"Homemade animation, Doraemon"
183,《五等分的花嫁》OP真人版 第二季,"The second season of the OP live-action version of ""Five-point Flower Marriage"""
184,【能转】电车之琳,[Can turn]Rin of the Tram
185,䌷壮壮又在卖萌,You are strong and cute again
186,【原神手书】胡桃「落梅随蝶影，他处再逢君」,"[Yuanshen's handwriting]Walnut ""Follow the butterfly shadow, and meet the king again elsewhere"""
187,【逐帧还原】暗 影 刺 刻,[Restore Frame by Frame]Shadow Thorn
188,承太郎：“过个年真不容易...”,"Jotaro: ""It's not easy to have a new year..."""
189,如果承太郎和DIO都是美少女......,If Jotaro and DIO are beautiful girls...
190,如果你觉得自己很蠢，请别忘了团藏曾用手里剑桶须佐,"If you think you're stupid, don't forget Danzo used a shuriken barrel Susa"
191,100％风情小土妞（先行版）,100% style little local girl (first version)
192,这些女团里的狠人行为，你最喜欢哪一个？,Which of these ruthless behaviors in the girl group is your favorite?
193,哥谭市...已经...没救了.....,Gotham City...has...don't save...
194,用营销号的方式打开《进击的巨人》,"Open ""Attack on Titan"" with a marketing account"
195,华生：都别动！他手里有枪！,Watson: Don't move! He has a gun in his hand!
196,蝙蝠侠：我的隐形战机是不可能被发现的！,Batman: My stealth fighter is impossible to find!
197,“每日一遍，快乐不在”,"""Every day, no happiness"""
198,【梗百科131】地狱客栈？赛博皮卡？吃个胡萝卜都能成梗了！！？？,[Stalk Encyclopedia 131] Hell Inn? Cyberpick? Eating a carrot can make a stalk! ! ? ?
199,《全职高手》叶秋成名技“龙抬头”看哭了多少粉丝的眼眶!心酸的精彩,"""Full-time master"" Ye Qiu's famous skill ""Long Look Up"" sees how many fans have cried in the eyes! Sad and wonderful"
