2324,【奥特燃起来了/泽塔奥特曼】全程高能 泽塔奥特曼完结纪念 Promise for the future,[Ultra is on fire/Ultraman Zeta] The whole process of high-energy Ultraman Zeta ends to commemorate Promise for the future
2325,大古：总有一天，我会再次拿起神光棒，变成迪迦！,"Dagu: One day, I will pick up the magic stick again and become Tiga!"
2326,这才叫特摄 这才叫奥特曼,"This is called Tesho, this is called Ultraman"
2327,【MAD/燃向】这是我们新生代的climax！以英雄之名！让新时代照亮我们的一切吧！,[MAD/Ranxiang] This is the climax of our new generation! In the name of a hero! Let the new era illuminate everything for us!
2328,【吐槽解析】奥特曼中的月球文明，莫名其妙根本搞不懂！,[Tucao Analysis] The lunar civilization in Ultraman is inexplicable and can't be understood at all!
2329,【wellerman】五常的压迫感2.5（画作重置版）,[wellerman] Wuchang's sense of oppression 2.5 (painting reset version)
2330,《铠甲勇士帝皇侠MV 『涅槃重生 帝皇再临』》,"""Armored Warrior Emperor's Man MV ""Nirvana Rebirth, The Emperor's Return"""""
2331,【特摄MAD】RED FIGHT!红超人《红超人主题曲MVレッドマン》,"[Special Photo MAD]RED FIGHT! Red Superman ""Red Superman Theme Song MV レッドマン"""
2332,勇次郎VS愚地独步，死神与武神的碰撞，可惜最后却成了单方面碾压,"Yujiro VS Shidi Dubu, Death God and Valkyrie collided, but unfortunately it turned out to be a one-sided crush in the end"
2333,盘点一下泽塔跟赛罗学会了什么,Take stock of what Zeta learned from Ciro
2334,抖S美女竟然对自家的狗子感兴趣，甚至还想和狗子生孩子？,"Shaking S beauty is actually interested in her own dog, and even wants to have a child with the dog?"
2335,铠甲勇士主题曲一部比一部燃！你是否都听过,The theme song of the armored warriors is burning one by one! have you heard
2336,【特效字幕】铠甲勇士 帝皇侠剧场版 帝皇侠初变身,[Special effects subtitles] Armored Warrior Emperor's Hero Theatrical Version The Emperor's Hero First Transformation
2337,【元气骑士】可以松开了吗？,[Energy Knight] Can you release it?
2338,这个冬天很铁血！很热血！【雪景+战损，mg巴巴托斯制作实录】,"This winter is bloody! Very hot! [Snow scene battle damage, production record of mg Barbatos]"
2339,450元的套装里有什么？爆裂飞车4 龙年至尊全家福套装 大鹏评测,What's in the $450 package? Explosion Speed ​​4 Dragon Year Supreme Family Portrait Set Dapeng Review
2340,【声优竟是同一人】盘点在《鬼灭之刃》与《东京喰种》中同时出现的声优，你听出来了吗,"[The seiyuu is actually the same person] Counting the seiyuu who appeared at the same time in ""Demon Slayer"" and ""Tokyo Ghoul"", can you hear it?"
2341,【不要脸解说】新世界Cross-Z剧场版，关于战兔的头发是怎么绿的这件事,"[Shameless Commentary] New World Cross-Z theatrical version, about how the war rabbit's hair is green"
2342,派大星vs奥特曼，没有和奥特曼决斗过的派生是不完整的,"Paidaxing vs Ultraman, the derivative without duel with Ultraman is incomplete"
2343,【99对cp / 青春】我们的世界已坠入爱河~,[99 pairs of cp / youth] Our world has fallen in love~
2344,和自己接吻是什么感觉？ 《约会大作战》中的士织变精灵啦！,"How does it feel to kiss yourself? The taxi weaving in ""Dating Battle"" has turned into a wizard!"
2345,测一下，你最像新生代奥特曼中的哪位？,"Take a test, which one of the new generation Ultraman do you most resemble?"
2346,【享受一笔一划】万代 SDEX GUNDAM EXIA 能天使高达,[Enjoy one stroke and one stroke] Bandai SDEX GUNDAM EXIA Gundam
2347,2022年贺年铁血奥尔加祭 宣传PV,2022 New Year Jagged Olga Festival Promotional PV
2348,洗脑神曲《Touch》，鬼知道我看了几遍！！,"Brainwashing Divine Comedy ""Touch"", the ghost knows how many times I've watched it! !"
2349,【元旦特辑】今年赚翻啦！一年一度的日本车模福袋开箱！,[New Year's Day Special] Earn money this year! The annual Japanese car model lucky bag unboxing!
2350,2000元买了个丑家伙！这款船夫卡隆让我直呼真香-刘哥模玩,2000 yuan to buy an ugly guy! This boatman Caron makes me call it really fragrant - Liu Gemo play
2351,《机动奥特曼 ULTRAMAN》【第二季】中文预告,"""Mobile Ultraman ULTRAMAN"" [Season 2] Chinese Trailer"
2352,【特利迦奥特曼｜涩向】真搞不懂现在的奥特曼，道德在哪里？尊严在哪里？联系方式在哪里？地址又在哪里？可以摸哪里？,"[Ultraman Triga | Shixiang] I really don't understand the current Ultraman, where is the morality? Where is the dignity? Where is the contact information? Where is the address? Where can I touch?"
2353,【原神配音】穿这个好难走路啊！,[Voice of the original god] It's so hard to walk wearing this!
2354, 别人家的妹妹 ,  Someone else's sister  
2355,熊出没（奥特曼配音）,Bears haunt (Ultraman voice)
2356,假面骑士01最终形态音效？！,Kamen Rider 01 final form sound effects? !
2357,圆满了！官方终于把这个坑填了！机械羊,Complete! The official finally filled this hole! mechanical sheep
2358,当斯沃鲁兹以为小明哥失去力量的时候响起了那首BGM,That BGM sounded when Swaruz thought that Brother Ming had lost his power
2359,什么星奥特曼大集合，一共找到六个，这次碟片盲盒靠谱不？,"What star Ultraman collection, a total of six were found, is this disc blind box reliable?"
2360,那些刻入你DNA的假面台词&万恶之源 ,Those masked lines that are etched into your DNA
2361,【1080p】超全历代铠甲勇士 合体变身合集,[1080p]Super complete armored warriors of all dynasties
2362,五分钟爱上他!奥特曼燃剪《欧布祈愿》主题曲MAD,"Fall in love with him in five minutes! Ultraman burns and cuts the theme song MAD of ""Obu Prayer"""
2363,历代奥特曼比例图（1996—2017）,Proportion of Ultraman in past dynasties (1996-2017)
2364,盘点不同时期的初代奥特曼，你觉得哪个时期更厉害,"Inventory of the original Ultraman in different periods, which period do you think is more powerful"
2365,7个不同版本的哥莫拉，你觉得哪个最强？,"7 different versions of Gomora, which one do you think is the strongest?"
2366,这款流心蛋包饭，邻居家小孩看到都要馋哭了【乐高定格动画】,"This flowy omelette, the children in the neighborhood will cry when they see it [Lego Stop Motion Animation]"
2367,一直在摇瓶子的桐生战兔！【描改手书】,Kiryu War Rabbit who has been shaking the bottle! [Drawing and changing handbook]
2368,【竖笛漫话】完结合集 JOJO的奇妙冒险第六部《石之海》漫画解说『JOJO6』,"[Cryptor Talk]Complete the collection JOJO's Bizarre Adventure Part 6 ""Sea of ​​Stones"" comic commentary ""JOJO6"""
2369,你当你的火影，我做我的海贼王，这很合理吧！！,"You are your Hokage, and I am my One Piece, right? !"
2370,【Let's Get Retarded】【描改手书】猴哥：那就，给小娃娃们跳一段吧~,"[Let's Get Retarded] [Description and modification of handwriting] Brother Monkey: Then, let's dance for the little dolls~"
2371,【JOJO】屑dio用吸血鬼便利工作,[JOJO]Small dio uses vampires to facilitate work
2372,【JOJO】三爹の奇妙变小冒险,[JOJO]Three Dad's Bizarre Small Adventure
2373,【比例图】火焰超人 全登场怪兽比例图,[Proportion]Proportion of all monsters on the scene of Superman
2374,嘴臭巫女“博丽咲川”,"Beak shrine maiden ""Hakurei Sakigawa"""
2375,国 漫 第 一 女 神 ！复 活 ！小 舞 回 来 了 ！,The first goddess of national comics! Resurrection! Xiao Wu is back!
2376,爷青回！铠二演员们的现状～,Ye Qing is back! The current situation of Kaiji actors~
2377,【松鼠片】真的嘛，我不信,"[Squirrel Movie] Really, I don't believe it"
2378,自制动画，西游记3-有一只猴子前来买瓜,"Homemade animation, Journey to the West 3 - A monkey came to buy melon"
2379,花14000元买一把刀剑神域的阐释者！父母：你敢买回来试试！,"Spend 14,000 yuan to buy a Sword Art Online interpreter! Parents: You dare to buy it and try it!"
2380,【ReD】小高真的放飞了？全员恶玉第七集 | 选择解析,[ReD] Is Xiao Gao really released? All Evil Jade Episode 7 | Choice Analysis
2381,谢怜：“三郎，快停下……”【花怜初次｜这样的大花你还嫌弃吗】,"Xie Lian: ""Sanlang, stop quickly..."" [Hua Lian for the first time | Do you still dislike such a big flower]"
2382,【石川界人】中文真“有趣”,"[Kaito Ishikawa] Makoto Chubun ""Tasteful"""
2383,【原神×LoveLive!联动】胡桃『Queendom』MV,"[Genshin Impact × LoveLive! Collaboration] Walnut ""Queendom"" MV"
2384,颜值和木村拓哉抗衡的男人,The man whose face value competes with Takuya Kimura
2385,送小朋友假面骑士腰带是一种什么样的体验？,What kind of experience is it to give a child a Kamen Rider belt?
2386,【奥特群像 跨年纪念】填词 九九八十一,"[Group Portrait of Ott, New Year's Eve]Complete Lyrics 9981"
2387,【盘点解析】赛罗奥特曼—新生代出场盘点,[Inventory Analysis] Ultraman Cerro - New Generation Appearance Inventory
2388,你先勾引我，你要对我负责~,"You seduce me first, you have to be responsible for me~"
2389,宝可梦官方动画短片：「等我哦！鲤鱼王」,"Official Pokémon Animated Short: ""Wait For Me! Carp King"""
2390,啊这，我也就看了几百遍吧！！,"Ah, I've watched it hundreds of times! !"
2391,【特摄＆游戏】感谢 你曾来过,[Special photo & game]Thank you for coming
2392,【游戏王】盘点王样的栗子球的可爱举动,[Game King] Inventory of the cute behavior of the king-like chestnut ball
2393,【OVERLORD】安兹曾被霸陵？公会濒临解散？纳萨力克有多少逆天的无上至尊？（上）,[OVERLORD]Ainz was bullied? The guild is on the verge of disbanding? How many supreme beings does Nazarick have? (superior)
2394,宝可梦旅途的真相!为何小豪正式成为主角!,The truth of Pokémon's journey! Why did Xiaohao officially become the protagonist!
2395,火影杂谈：须佐能乎各形态详解，宇智波家的高达形态居然这么多？,"Hokage Miscellaneous: Susanoo's various forms are explained in detail, and there are so many Gundam forms in the Uchiha family?"
2396,犬夜叉那些意难平的瞬间，全员燃虐,"Inuyasha's uneasy moments, all the members burned and abused"
2397,【一人之下】细姐！张灵玉一血失的不亏！,[Under one person]Sister! Zhang Lingyu's blood loss is not a loss!
2398,2022年，你还记得那对兄妹吗? 万人血书第二季！那么，游戏开始了。,"In 2022, do you still remember that pair of siblings? The second season of The Book of Ten Thousand Blood! So, the game begins."
2399,【洗脑】同 志！吨 吨 吨,[Brainwashing] Comrade! ton ton ton
2400,【MMD】小姐姐当中混入了一只小GUMI,[MMD] A little GUMI was mixed in among the little sisters
2401,型月设定中的最强英灵-觉者篇,The Strongest Heroic Spirit in Xingyue Setting - Awakening
2402,骨傲天【特典03】：骨王召见赛巴斯，被弄得一头雾水,Gu Aotian [Special Code 03]: The Bone King summoned Sebas and was confused
2403,骨傲天第四季（第五集14）：听到死亡骑士阵亡，骨王被吓到震惊,Bone King Season 4 (Episode 5 Episode 14): The Bone King was shocked when he heard that the death knight was killed
2404,测测你适合年上恋还是年下恋，更喜欢姐姐还是妹妹,"Test whether you are suitable for a new year or a new year, and whether you prefer an older sister or a younger sister"
2405,卫宫家的男人水很深，你把握不住！,"The men in the Emiya family are deep in water, you can't control it!"
2406, 萨克斯布丁 【像素方舟】, Saxophone Pudding [Pixel Ark]
2407,【妹抖龙手书】康娜捶胸【锤子之歌】,[Sister Shaking Dragon's Handwriting] Kang Na beats her chest [Song of the Hammer]
2408,【灵魂配音】灰原哀：我不干净了！！！,[Soul Dubbing] Haibara Ai: I'm not clean anymore! ! !
2409,【文静隐形守护者游戏回】被陆望舒气晕，什么叫女人都这样？我就不这样！不准地图炮我们女人！,"[Wenjing Invisible Guardian Game Back] Being dizzy by Lu Wangshu, what does it mean for women to be like this? I don't! No map guns are allowed on our women!"
2410,姑娘！你嘴上说的漂亮，身体却很诚实啊！,"girl! Your mouth is beautiful, but your body is very honest!"
2411,当夜斗上了日和的身，竟然干出这样的事....,"When Yato got on Hiyori's body, he actually did such a thing..."
2412,动漫中史诗级的大招，你知道几个？『一』,"Epic big moves in anime, how many do you know? ""one"""
2413,一觉醒来身边多个萌妹子，且被发现！场面一度难以控制！,"When I woke up, there were many cute girls around me, and they were discovered! The scene was once uncontrollable!"
2414,早睡秘籍2,Early to bed cheats 2
2415,假如你有一个这样的女朋友....,If you have a girlfriend like this....
2416,佩奇：来吃安眠药了！！,Peppa: Here's to sleeping pills! !
2417,亲够了吗？妹子要窒息了！！,Are you kissing enough? The girl is about to suffocate! !
2418,怎么能玩蛇呢？蛇蛇这么可爱！,How can you play snake? Snakes are so cute!
2419,丧尸宇宙来了！黑豹成为丧尸的储备粮，幕后主使是他！what if 第五集讲了啥？,"The zombie universe is here! The black panther has become the reserve food for the zombies, and he is the mastermind behind it! what if episode 5 about what?"
2420,【弱音MMD/2K全面屏】 花嫁弱音丨想做你的女朋友，撞进你的心里 小鹿乱撞,"[Music MMD/2K full screen]  Hana Married Musik|Want to be your girlfriend, slam into your heart   Xiaolu rammed"
2421,【4K】初音的君の彼女-好像在哪里听说过，初恋基本是没有结果的~,"[4K] Hatsune's Jun の の daughter - I seem to have heard of it somewhere, first love is basically fruitless~"
2422,“粉粉的短裙，飘逸的长发”！没错！是仙女下凡。,"""Pink skirt, long flowing hair""! That's right! A fairy descended to earth."
2423,【1080P/60FPS/唯美MMD】愿世界安宁，没有纷争。いつかは，気持ち分かり合えかな,"[1080P / 60FPS / Beautiful MMD] The world's peace of mind, the dispute over the dead. I wonder if someday I can understand each other"
2424,【野良神：夜斗&绯】真真病娇绯：夜斗，像以前一样多用用我吧！,[Noragami: Yato
2425,当你变身成假面骑士时你变成了,When you transformed into Kamen Rider you became
2426,虚 空 联 动 现 场,Void linkage scene
2427,『蓝光』『假面骑士ZIO』魔王老婆 和服 变身!,"""Blu-ray"" ""Kamen Rider ZIO"" Demon King's Wife Kimono Transformation!"
2428,【4K】日本横滨 1:1 元祖高达RX78 傍晚启动展示 / AMANO Jun-ichi,"[4K] Yokohama, Japan 1:1 Gundam RX78 Evening Launch Show / AMANO Jun-ichi"
2429,不 想 成 为 你 的 妹 妹，但……,"I don't want to be your sister, but..."
2430, 【妮妮姆】白毛红瞳，黑丝 侧 乳，这样的老婆谁能拒绝？？？ ," [Ni Nim]white hair, red pupils, black silk side breasts, who can refuse such a wife? ? ?  "
2431,错误操作，姨妈居然来了一个月 | 原创动画 | 我的爸爸是条龙哦,"Wrong operation, my aunt came for a month | Original animation | My father is a dragon"
2432,怀孕了，这TM是谁干的？,"Pregnant, who did this TM?"
2433,B站用户名演绎“暗的支配者”-迪迦,"Username of station B interprets ""Dark Dominator"" - Tiga"
2434,[JOJO]老东西你的妈妈最好看啦,[JOJO] Your mother is the best looking old thing
2435,【Undertale/中文字幕】请Sans唱了一首《宣告春天》,"[Undertale/Chinese subtitles] Sans sang ""Declaration of Spring"""
2436,来和SANS一起玩手指游戏吧！！！,Come and play finger games with SANS! ! !
2437,是AU幼儿园第二集哟~☆,This is the second episode of AU Kindergarten~☆
2438,【Undertale彩漫】当福官宣结婚时？三重审判警告！,[Undertale Color Man]When Fu Guan announces his marriage? Triple Judgment Warning!
2439,JOJO的奇妙冒险 4k全景,JOJO's Bizarre Adventure 4k Panorama
2440,当青鸟响起时！我们知道曾经的火影又回来了！,When the blue bird rings! We know that the old Hokage is back!
2441,【Unravel完整版】杀戮之花，暴噬万物-喰种全系列混剪,[Unravel Full Version]Flowers of Killing
2442,【精灵宝可梦搞笑漫画】无敌的琴音/芽衣的胸前装的是面包！？,[Pokémon Funny Comics] The invincible Kotone/Mei's chest is filled with bread! ?
2443,沙 耶 香 小 火 车,Sayaka small train
2444,耗时60小时的JOJO踩点，前方高帅！瞬间沉沦...,"It took 60 hours of JOJO to step on the spot, and the front is handsome! Instantly sinking..."
2445,【比例图】变形金刚历代擎天柱比例图,[Proportion diagram]Proportion diagram of Optimus Prime in the past dynasties of Transformers
2446,从前有个神笔马良画了十个太阳，结果你想象不到,"Once upon a time, there was a magic pen Ma Liang who drew ten suns, but you can't imagine the result"
2447,【第一人称视角/MMD】跟初音打一架,[First-person perspective/MMD] Fight with Hatsune
2448,「幻世『THE WORLD』」,"""Fantasy ""THE WORLD"""""
2449,【朱亚文】被Dio扼住了喉咙！我太疼了！#甭正面#04,[Zhu Yawen] Choked by Dio! I'm in so much pain!
2450,再玩一次不玩了,don't play again
2451,【茶杯头同人】最后一滴贪婪︱Cuphead: Last Drop Of Greed (by LucHD),[Cuphead]Last Drop Of Greed︱Cuphead: Last Drop Of Greed (by LucHD)
2452,【亲吻进行时】,[While the kiss is in progress]
2453,jojo星尘斗士-花京院典明处刑曲变奏加强版！,jojo Stardust Crusaders-Enhanced version of Huajingyuan's Execution Song Variation!
2454,【开联/meme】I am the man［宅家全员］,[Opening/meme] I am the man [all members of the house]
2455,【凹凸世界】【美人鱼经典片段】因嘉德罗斯长时间没镜头，嘉吹竟闯入qcs！,"[Bump World][Classic Mermaid Fragment]Because Gardros has been out of camera for a long time, Jiachui actually broke into qcs!"
2456,自制动画，二仙桥VIP,"Homemade animation, Erxianqiao VIP"
2457,牛年当然要吃NTR！别这样，吻我！,"Of course, you must eat NTR in the Year of the Ox! Come on, kiss me!"
2458,火影里让人无法忍受的设定,Unbearable settings in Naruto
2459,大人，时代变了！！,"Sir, times have changed! !"
2460,大古最后一次变身迪迦奥特曼，大决战！超奥特八兄弟对抗强大的黑暗法师,"Dagu transforms into Ultraman Tiga for the last time, the final battle! The Eight Ultra Ultra Brothers Fight Against the Powerful Dark Mage"
2461,高斯：让我教教你们！正确的落地姿势,Gauss: Let me teach you! correct landing posture
2462,当你把鬼灭之刃的配音换成了四川话，居然毫无违和感【鬼灭之刃】鬼灭之刃配音,"When you change the dubbing of Ghost Slayer to Sichuan dialect, there is no sense of disobedience [Ghost Slayer] Ghost Slayer's dubbing"
2463,社死！直播的时候去上厕所居然被面捕识别到了！,"Society is dead! When I went to the toilet during the live broadcast, I was recognized by the face arrest!"
2464,绝了！当大圣遇上唢呐鬼知道我看了几遍！宁做一日齐天大圣 不做一世斗战胜佛,"Absolutely! When the great sage meets the suona ghost, I know how many times I've watched it! I'd rather be a great sage who is equal to the sky for one day than a lifetime to defeat the Buddha"
2465,大年初一我在河边捡到美少女（新年篇02）,"On the first day of the new year, I found a beautiful girl by the river (New Year's chapter 02)"
2466,【神楽七奈×花园花玲】ぴこぴこ東京-Pico Pico Tokyo【翻唱】,[Nana Kagura x Nana Kagura] Pico Pico Tokyo [Translation]
2467,【国动鉴赏】与巴啦啦小魔仙并驾齐驱的国产大型真人剧！它争议满满，两极分化极为严重！金星评价它毁三观，它到底是好是坏？它还有抄袭行为？全程尴尬？解说《舞法天女》,"[National Movement Appreciation] A large-scale domestic live-action drama that keeps pace with Balala Little Magic Fairy! It is full of controversy and extremely polarized! Venus commented that it destroys the three views, is it good or bad? Does it also have plagiarism? Embarrassing all the way? Explanation of ""Dancing Goddess"""
2468,无法进化成亚极陀的物种，假面骑士Gills！！,"A species that cannot evolve into Agito, Kamen Rider Gills! !"
2469,蜘蛛侠成为怪物的杀戮机器！毒液拯救世界？如果漫威电影这么拍就太好看了！,Spider-Man becomes a monster killing machine! Venom saves the world? It would be great if Marvel movies were made like this!
2470,“伤 害 不 高 ，侮 乳 性 极 强 ！”,"""The damage is not high, and the milk is very insulting!"""
2471,海绵宝宝中最讽刺黑心商人的一集，为了赚钱，居然让客人吃地沟油,"The most satirical episode of the black-hearted businessman in SpongeBob SquarePants, in order to make money, he actually let customers eat waste oil"
2472,【古月宝番外篇02】末日在即校花向我说出她身体的秘密,[Gu Yuebao Extra Story 02] Doomsday is the school flower who told me the secret of her body
2473,【Animenz】unravel  钢琴版,[Animenz]unravel piano version
2474,这部男主惨爆了！不仅被绿还被天天秀恩爱？神作堕落！这些动画你不想第二季！,"This male protagonist is horrific! Not only being green, but also being loved by Tiantianxiu? God has fallen! These animations you don't want season 2!"
2475,【盾娘第二季20】梅普璐竟然输给这个boss了？,[Shield Girl Season 2 20] Did Maple actually lose to this boss?
2476,殊座为什么这么多病娇音声？【°˖✧殊座のことうけ°˖✧】【殊座Q&A 2022.01.22】,Kotoza Yandere voice? [° ˖✧ Kotoza ° ˖✧] [Kotoza Q
2477,这样的惩罚再给我来十个，我愿意！,"Give me ten more such punishments, I am willing!"
2478,起床之后，请...请对我...温柔点,"After waking up, please...please be gentle with me..."
2479,爷童回！六个童年动漫角色给你拜年啦！祝大家春节快乐！【高全胜】,Grandpa is back! Six childhood anime characters wish you New Year's Eve! Happy Spring Festival everyone! [Gao Quansheng]
2480,日本留学|被百分百中奖骗钱的老二次元人|快乐恰谷日本动漫周边应援eva,Studying in Japan | The old two-dimensional person who was cheated by 100% winning the lottery | Happy Chagu Japanese animation peripheral support eva
2481, 我 的 老 婆 绫 波 丽 , My Wife Aya Polly  
2482,火 影 护 妻 狂 魔,Naruto Guardian Wife Maniac
2483,妮娜被李笑愁改造成比克生化人，青山使用茨纳米单挑酷雷伏铠甲,"Nina was transformed by Li Xiaochou into a Bick cyborg, Qingshan used Zinami to single out Kuleifu's armor"
2484,你是否能成功攻略你喜欢类型的女生？【配音互动视频】+【原创剧情】,Can you successfully capture the type of girl you like? [Interactive video with dubbing] [Original plot]
2485,恐 龙 大 师 乔 治,Dinosaur master george
2486,【新刃牙】第14话 当刃牙看到女友3X是会发什么事情，进化吧刃牙,"[New Sabertooth] Chapter 14 What happens when Sabertooth sees his girlfriend 3X, let's evolve Sabertooth"
2487,“为了变的更强我要舍弃明天”,"""In order to become stronger, I have to give up tomorrow"""
2488,史上首个两位一体的假面骑士，到底是如何诞生的？大叔也太帅了吧,How did the first two-in-one Kamen Rider come about? Uncle is too handsome
2489,如果咲夜偷偷穿了蕾咪的衣服…,If Sakuya secretly wears Remi's clothes...
2490,【刀剑乱舞】爷爷请你饮茶（声真似！）,[Sword Ranbu] Grandpa invites you to drink tea (sounds like!)
2491,【手描刀剑乱舞】刀.剣.修.学.旅.行.★又是喜闻乐见的合宿~★,[Hand-drawn sword dance] Sword. Sword. Repair. Learn. Travel. Travel.
2492,【双黑】最佳损友,[Double Black]Best Loser
2493,［误解向］开始计划生育的由崎司,"[Misunderstanding] Yusaki Ji, who started family planning"
2494,被妹子绑架到保健室怎么办？！动漫中的那些糟糕的姿势,What should I do if I am kidnapped by my sister and taken to the health room? ! bad poses in anime
2495,老妈又找了个后爸，女儿很无奈......,"The mother found a stepfather again, and the daughter was very helpless..."
2496,【后宫推荐】b站有史以来尺度最大的后宫番，女主竟然为了得到男主干出这种事情！！！,"[recommendation of the harem] The largest harem fan in the history of station b, the heroine actually did this kind of thing to get the male lead! ! !"
2497,【互动游戏】世界毁灭一千年后，你能否重新拯救世界？,"[Interactive Game]A thousand years after the world was destroyed, can you save the world again?"
2498,十六夜咲夜的千层套路~,Izayoi Sakuya's Melaleuca routine~
2499,心音！！事务所停电辣！！！！,Heart sound! ! Power outage at the office! ! ! !
2500,“无人能敌我一拳”,"""No one can beat me with a punch"""
2501,海贼王娜美又又又又又又又又露啦！？路人表示:我好了！,One Piece Nami is exposed again and again! ? Passers-by said: I'm fine!
